Activacion,Tokens Id,Context
0.101084694, =," returned to the first @-@ class game for the first time since 2006 , and Alfonso Thomas . Stiff took 31 wickets , more than quadrupling his career first @-@ class w"
0.09889944, =," 1 @,@ 968 long tons ) . She was propelled by two two @-@ shaft , four cylinder vertical triple expansion steam engines . On trials , they developed 18 @,@ 000 i"
0.09729391, and, boat defence she carried six 45 @-@ caliber 100 @-@ millimeter ( 3 @.@ 9 in ) guns in casemates and eighteen 47 @-@ millimeter ( 1 @
0.0969256, and," her 12 Yarrow @-@ type coal @-@ fired boilers . She had a maximum range of 4 @,@ 000 nautical miles ( 7 @,@ 400 km ; 4 @"
0.09678781, and,"s move to investigate toll rebates . Initially , tolls were $ 0 @.@ 25 for SunPass users , with a $ 0 @.@ 15 surcharge for motorists using the toll @"
0.096271664, and," Leptoceratops . The Ceratopsoidea includes animals like Zuniceratops , which are more closely related to the family Ceratopsidae . This last family includes"
0.09542149, and, mounts and she received four single mounts for the semi @-@ automatic 76 @.@ 2 mm 34 @-@ K were fitted as well as six 12 @.@ 7 mm ( 0 @
0.094417036, =," time that two women co @-@ anchored Weekend Update . Fey revealed that she "" hired "" Poehler as her co @-@ host for the segment . The reception was positive , with Rachel Sk"
0.09430577, and,"@ 796 t ( 25 @,@ 389 long tons ) as built and 28 @,@ 600 t ( 28 @,@ 100 long tons ) fully loaded , with a length of 175 @"
0.0941827, =," of 400 @,@ 000 copies . In Scotland , the song reached number five . It achieved success in Ireland , reaching number 8 on 31 December 2015 . It peaked at number 66 on the Belgium Ultr"
