Activacion,Tokens Id,Context
0.14346883, =," . Agustín listens helplessly as Urania recounts his past as "" Egghead Cabral "" , a high @-@ ranking member of Trujillo 's inner circle , and his drastic"
0.1320048, =," excavate at the Roman fort of Segontium ; accompanied by his wife , he used up his holiday to oversee the project . A second season of excavation at the site followed in 1922 . Greatly"
0.13004678, and," accused of worshiping images , in violation of the first commandment , the Church says this is a misunderstanding . In the Church 's opinion , "" the honor paid to sacred images is a ' respectful"
0.12900245, and," authenticity that might have otherwise been missing had she recorded these songs just a few years earlier . "" 
 NPR 's Ken Tucker described the album as a "" glossy but heartfelt work "" and approvingly"
0.12823194, and,"ified by poems including "" Ode to a Nightingale "" : 
 The injustice which has been done to our author 's works , in estimating their poetical merit , rendered us doubly"
0.12637758, and, it readily identifies the chromosomal translocation [ t ( 15 ; 17 ) ( <unk> ; <unk> ) ; ] that characterizes APL . There is also a need to molecularly
0.12590453, =," for stimmi . 
 The use of Sb as the standard chemical symbol for antimony is due to Jöns Jakob Berzelius , who used this abbreviation of the name st"
0.12574926, and,"@ goer , who then attacks her when she leaves the club . <unk> , the woman cries in the street after an implied sexual assault , and the video ends as she runs home to grab"
0.12509689, =," the first , to take advantage of the later @-@ developing grasses further up a hill . The nest , well hidden in the grass , is built in a scrape or hollow in the ground ."
0.12465226, =," and <unk> , "" to the surface of the moon . There are three Selenite exiles with whom the player can interact ; they live on the surface and sleep in their isolated underground st"
