Activacion,Tokens Id,Context
0.4506724, hostilities," Eaton remained in the RAF following the cessation of hostilities . He married Beatrice Godfrey in St. Thomas 's church at Shepherd 's Bush , London , on 11 January 1919 . Posted to No"
0.43832785, northwest," a village northwest of Bradford , a cosmopolitan city in Yorkshire , northeast England , which was then in the midst of the wool trade boom . Wheeler was inspired by the moors surrounding Saltaire and fascinated"
0.41442797,ller," boats are powered by a single seven blade propeller powered by an 83 MW ( 111 @,@ 000 hp ) pressurised water reactor and can achieve a maximum speed of 12 – 15 knots ("
0.4104291, Wheeler,"ansen praised Wheeler for systematising and professionalising Indian archaeology and for "" instituting a clearly defined body of techniques and methods for field and laboratory work and training . "" 
 On Wheeler '"
0.40853766, tricks," of fifteen : 
 I tried out my tricks first of all in the street , swallowing many glasses of water and then pouring forth a great fountain from one side of the road to the other ... A"
0.407439, pulls," and descends to help . However , this pulls up the other bucket , into which the fox has jumped , and so the two swap places ; the wolf at the bottom of the well and the fox"
0.40650815, of," a pair of destroyers . After returning to Pola , the entire fleet mobilized for possible hostilities , as tensions flared in the Balkans . 
 In 1913 , Zrínyi participated in an"
0.4058366, Nam," of the Nameless Oath ) , illustrated by Naoyuki Fujisawa and eventually released in two volumes after being serialized in Dengeki Maoh between 2011 and 2012 ; and Senjō"
0.40581638, well," . Meanwhile , Wheeler was well known for his conspicuous promiscuity , favouring young women for one night stands , many of whom were his students . He was further known for having casual sex in public"
0.40475923,hen," of Mohenjo @-@ daro and Harappa , he organised a very brief excavation which revealed fortifications around both settlements . He later led a more detailed excavation at Harappa , where he"
