Activacion,Tokens Id,Context
0.07762882, Taken," , the songs from Sholay attracted less attention than the film 's dialogue — a rarity for Bollywood . The producers were thus prompted to release records with only dialogue . Taken together , the album"
0.066232935, session," and final single from the album in the United Kingdom . It was one of four songs Carey wrote with Ric Wake during their first recording session together , but "" There 's Got to Be a Way """
0.064435184, Martin,"er , both from Malling , excavation resumed in early September . In 2009 , the archaeologists Martin Smith and Megan Brickley asserted that Bennett 's excavations had taken heed of the advice of Pitt @"
0.06385784, marketing," deal with Nike , were engineered by his agent , David Falk . Jordan has described Falk as "" the best at what he does "" and that "" marketing @-@ wise , he 's great ."
0.063832134, despite," 's career . He won Game 1 for the Bulls with a buzzer @-@ beating jump shot . In Game 5 , with the series tied at 2 , Jordan played despite being feverish and"
0.063225925, McKay," on February 1 , 1849 — Atherton was chairman of the Senate Finance Committee . McKay introduced a version into the House on February 20 ; debate began the same day . The dollar was attacked by"
0.06280662, heavy," I like the big heavy part and I always say , ‘ Let 's put the heavy ending at the end of "" Chemical Warfare "" and just do the last half . ’ But I could"
0.062480476, tried," a sketchbook with her for capturing interesting children . She once indicated , "" I have always tried to paint instinctively in a way that comes naturally to me , without any real thought or attention to artistic theories"
0.06190705, scientific," and anticommunist novels . 
 Censorship at first targeted books that were considered to be "" serious "" , including scientific and educational texts and texts that were thought to promote Polish patriotism ;"
0.06017861, stere," , shot on the Mumbai – Pune railway route near Panvel , took more than 7 weeks to complete . 
 Sholay was the first Indian film to have a stereophonic soundtrack and"
