Activacion,Tokens Id,Context
1.7816548, sun," aspects of existence were seen as deities . Although many deities were connected with the Nile , no god personified it in the way that Ra personified the sun . Short @-@ lived phenomena , like"
1.7480822, ecosystems," does not adversely affect endangered , rare and biogeographically significant plants ; ensuring that the herd does not further degrade the ecosystems in which it lives ; and preventing the herd from spreading into the Kaimanawa"
1.7394191, Ad," Strait of Otranto meant that the Austro @-@ Hungarian Navy was , for all intents and purposes , effectively bottled up in the Adriatic . Nonetheless , the presence of the Z"
1.7331662, differentiation," many people with AML ; the types of chromosomal abnormalities often have prognostic significance . The chromosomal translocations encode abnormal fusion proteins , usually transcription factors whose altered properties may cause the "" differentiation arrest"
1.726905, Meg," intercede with the forces of nature for the benefit of their living descendants . Archaeologist Robin Holgate stressed that rather than simply being tombs , the Medway Megaliths were "" communal <"
1.7156435, Meg," as well as later prehistoric monuments such as Stonehenge . 

 Coldrum Long Barrow is comparatively isolated from the other Medway Megaliths ; in this it is unique , given that the"
1.713303,ocks,"ung beetles . Food is taken from the ground , low @-@ growing plants and from inside grass tussocks ; the crake may search leaf litter with its bill , and run in pursuit of"
1.7107056, drugs," for treatment of leishmaniasis in domestic animals . Unfortunately , as well as having low therapeutic indices , the drugs are poor at penetrating the bone marrow , where some of the Leishmania amast"
1.705193, Meg," for the Ordnance Survey , listed the Coldrum Stones alongside the other Medway Megaliths . In 1926 , the Coldrum Stones were given to The National Trust , who dedicated it as a memorial"
1.7051332, Meg," <unk> deemed the Medway Megaliths to be "" some of the most interesting and well known "" archaeological sites in Kent , while archaeologist Paul Ashbee described them as "" the most grand"
