Activacion,Tokens Id,Context
0.10818983, ac," science in 1805 , and given its current name in 1889 , the species is commonly known as the charcoal loving elf @-@ cup , dwarf acorn cup , stalked bonfire cup , or"
0.10634833, State," Tar Heels , and greatly admired Thompson , who played at rival North Carolina State . He was inducted into the Hall in September , with several former Bulls teammates in attendance , including Scottie Pipp"
0.099417515, interest," website focused on the documentary was formed at Wikia , located at <unk> Regarding his financing strategy , Gibson commented to the San Francisco Chronicle , that smaller incremental donations from multiple individuals showed genuine interest in"
0.09916278, Max," as "" solid and understated , mercifully free of ' special effects ' and ' scenery chewing ' overall "" , but lamenting what she perceived as undue <unk> on the part of Max Brooks"
0.0957757, plans," by a military appointed panel . 
 Saprang was sidelined in security plans preceding the Constitutional Tribunal 's 20 May 2007 ruling on the dissolution of the Thai Rak Thai and Democrat Parties . After the 2006"
0.09526489, plans," @-@ bounds , and ensuring that the Royal Air Force changed its plans to construct a radar station in the midst of a Roman settlement . Aware that the British were planning to invade and occupy the Italian"
0.093543105, ac, fluctuate under several different managers and things came to a head in the summer of 2006 when David O 'Leary left in acrimony . After 23 years as chairman and single biggest shareholder ( approximately 38
0.09142081, our," was research for a comedy and also because we were going home every night in our fancy cars to sleep in our fancy hotels . "" The film was a commercial failure , despite receiving good feedback from test audiences"
0.09035549, 2009," ceremony on June 3 , 2001 . They have two daughters : Alice Zenobia Richmond ( born September 10 , 2005 ) and Penelope Athena Richmond ( born August 10 , 2011 ) . In April 2009 ,"
0.08893404, ep, into time @-@ binding and space @-@ binding types . Time @-@ binding media are durable . They include clay or stone tablets . Space @-@ binding media are more ephemer
