Activacion,Tokens Id,Context
1.8185617, should," should replace him . Wheeler vocally opposed the nomination of W.F. Grimes , deeming his career undistinguished ; instead , he championed Glyn Daniel as a candidate , although ultimately Grimes was"
1.8185617, should," should be cut loose , to which Harvey replied "" No ; we have got her and we will keep her "" . The two ships swung so close to each other that Brunswick 's crew could not open"
1.7719357, should," I don 't even think it should be reviewed or critiqued as a legitimate book . "" The book was also harshly criticized by Brown University Professor Omer Bartov and University of Chicago Professor Peter"
1.6833228, derivatives,"-@ organic derivatives , anions , and cations . Examples include Sb ( C6H5 ) 3 ( <unk> ) , Sb2 ( C6H5 ) 4 ("
1.6501108,oes," porticoes and an aisle at the back . Pillars , six in each row , divide the hall into a series of smaller chambers . The roof of the hall has concealed beams supported by stone columns"
1.6436713, The," by the same name . The film was directed by Paul Weitz . Fey later starred in the 2014 comedy @-@ drama This Is Where I Leave You , helmed by Date Night director Shawn Levy"
1.6398895, should," still couldn 't make up its mind on how it should improve airport security . AoT said it was open to all possible options , and has taken no action to upgrade the problem . 


"
1.6378442, The," The Spanish language is similar . The most important body within the Association of Spanish Language Academies , the Real Academia Española , publishes the <unk> de la <unk> Espa"
1.6351964, their," their associates throughout the day and night "" 

 Linda Catt , an activist , has suggested that their tactics are "" designed to intimidate people and prevent lawful dissent "" . This view is echoed by a"
1.6351964, their," their "" Jordan Rules "" method of guarding Jordan , which consisted of double and triple teaming him every time he touched the ball . 

 The Bulls entered the 1989 – 90 season as a team on"
