Activacion,Tokens Id,Context
1.9473205, think," bipolar disorder . "" I think that as an artist , in order for me to get to the next plateau , I kind of feel the need to explore things and sometimes that exploration leads you to places that"
1.9443215, think," ' is questionable . I think it has limited application to a few openings , rather than being an opening prescription for Black in general . "" Evans wrote that after one of his games against Fischer , "" Fischer"
1.9015524, states," it punishes with justice , not out of hatred , with prudence , not precipitation "" as a prerequisite for reconciliation with the church . Paul <unk> states that official Church teachings have neither absolutely condemned"
1.9001412, ailments," in the human world . Natural disasters and human ailments were seen as the work of angry divine bas . Conversely , the gods could cure righteous people of illness or even extend their lifespans . Both these"
1.8954779, states, fist ) . Liang <unk> states practitioners of Emei <unk> Qigong believe Yue trained under Zhou as a child and competed to become China 's top fighter at an early age
1.876419, resonate," the record to resonate a Memphis soul sound . He also collaborated with Joseph Trapanese to arrange and conduct a chamber orchestra . 

 In providing instrumentation for the record , Kurstin used all"
1.870924, unlike," . In Africa , it is more secretive than the African crake , and , unlike its relative , it is rarely seen in the open , although it occasionally feeds on tracks or road sides . The corn"
1.8661777, relocate, survivors abandoned in special zones in order to distract the undead and allowing those within the main safe zone time to regroup and recuperate . Governments worldwide assume similar plans or relocate the populace to safer foreign
1.8595376, want," point of view that is rarely heard in the United States . I have no problem saying that I do want to express solidarity with them , and I am not going to be a coward of ( sic"
1.8571763, unlike," uninhibited . He further notes that , unlike earlier melodramas in which the female body occupies the audience 's attention as an object of male fetish , in Sholay , the male body"
