Activacion,Tokens Id,Context
1.5896897, markers," Places in 1972 and is home to the Clinton County Historical Society . The Pennsylvania Historical and Museum Commission has placed three cast aluminum markers — Clinton County , Fort Reed , and Pennsylvania Canal ( West Branch Division )"
1.5748456, grains," any conspiracy theory , it contains several grains of truth ; and like any such theory , it is both irrational and insidious . 

 Finkelstein has accused journalist Jeffrey Goldberg of "" torturing "" or"
1.5736529, characters,"unes cartoon characters . A Nike commercial shown during 1992 's Super Bowl XXVI featured Jordan and Bugs Bunny playing basketball . The Super Bowl commercial inspired the 1996 live action / animated film Space Jam , which"
1.5727954, layers,"oven , and branched , measuring 3 – 5 @.@ 5 µm thick . The exoperidium ( the outer layer of tissue , comprising the rays ) is made of four distinct layers"
1.5704814, characters,"ifferentiated characters were . The Eagle described the book as being "" unlike any other zombie tale "" as it is "" sufficiently terrifying for most readers , and not always in a blood @-@ and @"
1.5613111, engines," was propelled by two two @-@ shaft , four cylinder vertical triple expansion steam engines . On trials , they developed 18 @,@ 000 ihp ( 13 @,@ 423 kW ) , which"
1.5605589,ers,"@ 19 m ( 30 ft 2 in ) . She was powered by three Bergmann steam turbines , three oil @-@ fired and twelve coal @-@ fired boilers , which developed a total"
1.5592073, guns," ) guns , placed in individual barbettes side by side amidships . She was also equipped with a single 5 @.@ 9 in ( 150 mm ) gun mounted on her stern , and four"
1.5563005, figures," Zagreb public figures , and many citizens . It was the first prominent public building in Zagreb 's lower town , and its architecture and scale aroused general admiration and praise . 


"
1.5386112, tissues," or conditioning effect on keratinized tissues , at least in animals . 

 Antimony @-@ based drugs , such as <unk> <unk> , are also considered the drugs of choice"
