Activacion,Tokens Id,Context
1.7727072, specialists,"> specialists suggesting that these had been created post @-@ mortem as the bodies were dismembered and the bones removed from their attached ligaments . However , they further suggested that the lack of"
1.5779684,cher, architect Ottaviano Mascherino ( who was credited with building the Apostolic Palace ) mainly to promote the study of astronomy for the Gregorian Calendar Reform which was commissioned by Pope Gregory XIII and promulg
1.5572418, Anton," Blue Jackets parted ways with defensemen Jan Hejda , Anton Stralman , Sami <unk> and Mike Commodore . Hejda , who played four of his first five NHL seasons with"
1.5569979, methods, to promote specific methods of religious instruction during the Middle Ages . The Fourth Lateran Council ( 1215 ) was the first attempt to remedy this problem . Surviving evidence reveals that some bishops ' efforts to
1.5557928, banks," , where for the most part , only gold and silver were acceptable currencies , and paper money traded at a discount . In the rest of the nation , gold and silver coins could be purchased from banks ,"
1.5522124, Aim," est important d 'être Aimé ( "" Aimé "" is a name which also means "" beloved "" ) . These translators differ in their attitude to the original English honorific titles , some"
1.5354055,els," now under the control of the German propaganda machine , saw their programming dominated by Nazi German movies , which were preceded by propaganda newsreels . The few Polish films permitted to be shown ( about 20 %"
1.5276779, Aim," est important d 'être Aimé ( "" Aimé "" is a name which also means "" beloved "" ) . These translators differ in their attitude to the original English honorific titles , some"
1.5125376, guns," . Boreas was completed on 21 February 1931 at a cost of £ 221 @,@ 156 , excluding items supplied by the Admiralty such as guns , ammunition and communications equipment . After her commissioning"
1.5101106, camps," , Jewish property was confiscated , and the Jews were subjected to mass arrests and deportations to death camps in Croatia and abroad . 

 In October 1941 , the newly installed mayor of Zagreb ,"
