Activacion,Tokens Id,Context
0.04770191, premiered," , at The Venetian Las Vegas , which premiered on NBC on December 11 , 2013 . In 2014 , Clarkson released the title track as the second single and hosted an annual Christmas benefit concert , Miracle"
0.04762347, ending, ending with black at the tip . The underside is plain white and the ventral fin fold is light grayish in color . This species grows to 24 cm ( 9 @.@ 4 in ) across
0.046478182, assigned," species , with A. europaeus not yet proposed and A. maximus assigned to Saurophaganax . 
 A. fragilis is the type species and was named by Marsh in"
0.04535663, him," keep him out of the line @-@ up for a month . Additionally , Sanford suffered a groin injury , leaving Allen York as the back @-@ up . York had only played four professional games"
0.044755295, aware," by pre @-@ existing tomb @-@ shrines that they were already aware of . Whether those people had grown up locally , or moved into the Medway area from elsewhere is not known ."
0.044080585, now,ITs have not been banned but they must now justify the retention of photographs on a case @-@ by @-@ case basis . As a result of the ruling the Metropolitan Police 's public
0.0429924, table," 0 at home to fellow mid @-@ table team Cheltenham , before beating Plymouth 4 – 0 away with goals from Fletcher , McCombe ( 2 ) and Carson as the team achieved successive"
0.0429371, now," museums that now supported German propaganda and indoctrination , such as the newly created Chopin museum , which emphasized the composer 's invented German roots . Restrictions on education , theater and music performances were eased"
0.04224743,ley," Ronnie Dunn , Kacey Musgraves , Hayley Williams , Charles Esten , and Meghan Trainor , some of whom will also join Clarkson in performing selections from Wrapped in Red . "
0.040904656, 5," 82 games , starting in 67 of them . He averaged 20 @.@ 0 points , 6 @.@ 1 rebounds , 3 @.@ 8 assists , and 1 @.@ 5 steals per"
