Activacion,Tokens Id,Context
0.0689026, Zap," however refused to recognize the interim government of de la Barra , and for the time being the fighting in Morelos continued . Madero met with Zapata on several occasions during June . While initially Zap"
0.057053618, large," , had the support of the Mexican financiers , who feared the downgrading of Mexican international credit and a general economic crisis as a result of ongoing social unrest , as well as that of the large"
0.05608308, Zap," pressured Orozco to drop out of the race . When , in the aftermath of the Plan of Ayala , Madero ordered Orozco to lead federal troops to suppress Zapata , Oroz"
0.054956414, the," of Exodus , either explicitly or subtly , such as in recurring references to Exodus 8 : 2 in Magnolia , which chronicles the plague of frogs , culminating with the literal raining of frogs in the film"
0.05188273, (," bearing surface of the cup , the hymenium , is brick red and smooth , while the exterior surface is a dull yellow , and may be either smooth or have blister @-@ like spots ("
0.051824294, collections," In 1941 , the last remaining Polish public library in the German @-@ occupied territories was closed in Warsaw . During the war , Warsaw libraries lost about a million volumes , or 30 % of their collections"
0.051234078,urt," on the songs , Timbaland finished work on ones already present in the studio that were half @-@ developed or just "" <unk> "" ; the rest were completely reworked . Furt"
0.05059641, theories," a sketchbook with her for capturing interesting children . She once indicated , "" I have always tried to paint instinctively in a way that comes naturally to me , without any real thought or attention to artistic theories"
0.050321456," ,"," 1861 , selected and purchased a parcel of land at the corner of Maria Valeria Street ( now Praška Street ) and Ban Jelačić Square , the central town square . However ,"
0.04880625, the," by Archibald Wavell , the Viceroy of India , who had been acting on the recommendations of the archaeologist Leonard Woolley , who had authored a report lamenting the state of the"
