Activacion,Tokens Id,Context
0.07828838, surveillance,"ousveillance on the officers . Two members of the group were arrested at the 2008 Climate Camp on obstruction charges . A similar police surveillance unit , the Video Intelligence Unit is operated by Greater Manchester Police ."
0.07519434,om, or imine group . A negative charge is transferred to the heteroatom and because the sulfonium cation is a good leaving group it gets expelled forming the ring . In the related Wittig
0.06569479,ish," @-@ armed Ardhanarishvara carving . This image , which is 5 @.@ 11 m ( 16 @.@ 8 ft ) in height , has a headdress ( double"
0.06243123, Cold," many television performances of "" Maneater "" . A version of "" All Good Things ( Come to an End ) "" featuring vocals by Coldplay lead singer Chris Martin , who co @-@ wrote the"
0.061256558,om," which was commissioned by Pope Gregory XIII and promulgated in 1582 . It was then also known as the Tower of Winds . The tower is now called the "" <unk> Astronomica Vatic"
0.060279317, usually," navigation and landing aids . They are usually located on urban fringes , support commercial and business operations , and often exclude certain types of light aircraft . At the more <unk> located airfields , the"
0.05998861, format," , particularly those suited to the new format were also included , such as digital logs which scatter in the direction of the camera during the first half of the film when the train collides with them , the"
0.05958812, base,"izomorphs ) extend from the base of the fruit body into the substrate . The rhizomorphs are fragile , and often break off after maturity . 
 The spores are spherical or nearly so"
0.059586734, and," city . 
 Exeter City and Yeovil Town agreed that on their meeting at St James Park on 8 August 2015 , there would be a minute 's applause in the seventh minute and ninth"
0.05844777, England," a village northwest of Bradford , a cosmopolitan city in Yorkshire , northeast England , which was then in the midst of the wool trade boom . Wheeler was inspired by the moors surrounding Saltaire and fascinated"
