Activacion,Tokens Id,Context
1.725779, was," material culture was shared throughout most of the British Isles in this period , there was great regional variation regarding the nature and distribution of settlement , architectural styles , and the use of natural resources . Throughout most of"
1.703399, techniques,"e rendering of his name ) was a monk who brought young Yue to the Shaolin Monastery and taught him a set of hand techniques , which Yue later adapted to create his Ying Kuen ( Eagle"
1.6983682, was," basis ... I say pleasure , because his answers were thoughtful and intelligent and he came across as a man who was delighted to be back home with his friends and family "" . 


 = = Career"
1.6896187, was," promising actresses opining she was ready for roles in Hollywood . 

 TV Week often commented on her pregnancy storyline . After the plot was half way through Erin Miller of TV Week said that Nicole had changed"
1.6891259, was," positions in divine society . At the apex of this society was the king of the gods , who was usually identified with the creator deity . In different periods of Egyptian history , different gods were most frequently said"
1.6873256, was," concept was raised again in August 1944 , and this time the new Central Area Command was to control maintenance units , as well as training and operations , in southern Queensland . Once again , nothing came of the"
1.6835903, was,"ershowitz 's book in which a phrase that he says Peters coined was incorrectly attributed to George Orwell : 

 "" [ Peters ] coins the phrase , ' turnspeak ' , she says she"
1.6822312, was," one god was believed to transcend the world and all the other deities , while at the same time , the multiple gods were aspects of the one . According to Assmann , this one god was especially equ"
1.6765784, was,"ence of the great gods was maintained by the ritual devotion that was performed for them across Egypt . 


 = = Origins = = 


 The first written evidence of deities in Egypt comes from"
1.6700565, invoked," the Roman Empire . Roman emperors , like Ptolemaic kings before them , invoked Isis and Serapis to endorse their authority , inside and outside Egypt . In the empire 's complex"
