Activacion,Tokens Id,Context
0.19847138, !," by Dennis Amith of J ! -ENT as a young woman with style , beautiful vocals , and the ability to take on various musical styles , may it be happy , upbeat rock music or "" even"
0.18950738, !," Viva Sarajevo ! Fuck the past , kiss the future ! "" at the beginning of "" Even Better Than the Real Thing "" . Bono had struggled with his voice throughout the tour ,"
0.18904673, July," Nathan made his Cubs debut on July 24 , 2016 against the Milwaukee Brewers . He pitched one inning and struck out the side , allowing one hit and one walk . 
 = = Records and notable statistics"
0.18818828, July, week until he heard on 20 July that the Council in London had declared for Mary . On the orders of the Privy Council Northumberland himself now proclaimed Queen Mary at the market @-@ place
0.186647, !," you 're my only hope ! "" from her past role in the original Star Wars trilogy , in which she played Princess Leia . 
 = = Reception = = 
 According to the Nielsen"
0.18555512, !," Story of Ozploitation ! = 
 Not Quite Hollywood : The Wild , Untold Story of Ozploitation ! is a 2008 Australian documentary film about the Australian New Wave of 1970s"
0.18526047, Hungary," Sarnia from his native Hungary to join Dow Chemical in 1957 . James Doohan , the well @-@ known Star Trek actor , attended high school in Sarnia . Harmonica virtu"
0.18493009, game," first New Year 's Eve game night , Reagan 's competitiveness comes out causing Chris to become embarrassed . Meanwhile , Missy ( Jennifer Hall ) brings an unexpected date along to the party and , Kevin"
0.18114896, humanitarian,"loading humanitarian aid , and a road had been repaired to make transport into the city easier . In an interview on 21 January , Leo <unk> , Haiti 's ambassador to the UN , said that"
0.18083638,20,"il which date from around 1420 , have always been in lay @-@ ownership ; "" abbey "" was added to their names in the 19th century . The 140 @-@ foot ("
