Activacion,Tokens Id,Context
1.9586438, invented," emphasized the composer 's invented German roots . Restrictions on education , theater and music performances were eased . 

 Given that the Second Polish Republic was a multicultural state , German policies and propaganda also sought"
1.7777152, maintain, recurring theme in these myths is the effort of the gods to maintain maat against the forces of disorder . They fight vicious battles with the forces of chaos at the start of creation . Ra and Ape
1.777148, white," is formed into conical shape not through moulding or pressure , but by curling and then gluing the two ends together . Against the black finish of the cabinet , the white bass / mid driver"
1.7384068, long,"ear shape , the Chestnut long barrow 's facade , and the long , thin mounds at Addington and Kit 's Coty . This variation might have been caused by the tomb @"
1.7311275, built," waned after Egypt lost control of the region . In contrast , many temples to the major Egyptian gods and deified pharaohs were built in Nubia . After the end of Egyptian rule there"
1.7068701, built," , new walls surrounding the inner court were built . They followed the earlier walls , with a narrow gap between them in the west and south which was turned into a gallery from which defenders could unleash missiles ."
1.7067664, plain," the plain maskray is thin and diamond @-@ shaped with narrowly rounded outer corners , measuring 1 @.@ 1 – 1 @.@ 3 times longer than wide . The leading margins of the"
1.7004353, white," white or black . Where one or more players withdraws from the tournament , the tournament director may change the assigned colors in some games so that no player receives two more blacks than whites , or vice versa"
1.7004353, white," white blood cell . In AML , though , a single myeloblast accumulates genetic changes which "" freeze "" the cell in its immature state and prevent differentiation . Such a mutation alone does not"
1.6946425, adopting," work , instead adopting a policy of neutrality . Without the need to satirise political types , Harry Thompson observed that "" Hergé was now concentrating more on plot and on developing a new style of character"
