Activacion,Tokens Id,Context
0.18260776, and," services to the Sarnia @-@ Lambton area . There are two magazines currently published in Sarnia , Business Trends and Report on Industry . Business Trends is distributed through City Hall and Report"
0.17688015, =," the ninja attack . As the screenwriter of the previous Bond films Richard Maibaum was unavailable , Roald Dahl , a close friend of Ian Fleming , was chosen to write the adaptation despite having no"
0.16751039, =," the average income is low because of the unstable political situation in the Palestinian territories , Israeli checkpoints , the West Bank barrier and the 2006 freezing by Israel of funds to the Palestinian territories — although the latter no"
0.16707759, and," estuary , leaving Atherstone and Tynedale as a sea patrol . The convoy adopted a new formation with the MGB and two torpedo MLs in the lead , followed by Campbelt"
0.16443436, and," , since as many as 50 transients had been camped at the base of the mountain while looking for work . Some residents believed that they had left Frank shortly before the slide , though there is no"
0.1638759, =," = General = = = 
 = Trials and Tribble @-@ ations = 
 "" Trials and Tribble @-@ ations "" is the 104th episode of the American science"
0.16356698, and,"mium contamination ) in the A @-@ 12 / SR @-@ 71 , U @-@ 2 , and subsequent aircraft programs that use titanium . 
 = = = Nuclear fission"
0.16354936, and,"ously paraphrased the sentiments expressed by McMillan , as this exact quote does not appear in her text . Instead , McMillan is expressing the observation that several nineteenth @-@ century writers"
0.16313902, =," leukemic cells . A lack of normal white blood cell production makes people more susceptible to infections ; while the leukemic cells themselves are derived from white blood cell precursors , they have no"
0.16207938, and," , the Netherlands , Norway , and Sweden on July 8 , 2003 . This digital EP was also available in Canada and Ireland on July 8 , 2003 . On July 22 , 2003 , two remixes -"
