Activacion,Tokens Id,Context
0.06478151, upon," including LeBron James and Dwyane Wade . In addition , commentators have dubbed a number of next @-@ generation players "" the next Michael Jordan "" upon their entry to the NBA , including <unk"
0.05022118, assumed," Dalmatia . Simultaneously she was commissioned as USS Zrínyi and Lieutenant E.E. <unk> , USN , assumed command . The initial American complement consisted of four"
0.048396498, .," joint venture mobile phone operator , were cut off temporarily in early May 2007 when owners TOT and CAT Telecom failed to pay the bills of a major supplier . Thai Mobile had accumulated significant losses and the company"
0.0479706, .,"@ 000 to 4 @,@ 500 years prior . Although the findings were not centralized in the area , this caused delays for the extension of the freeway . On August 6 , 1988 , <unk>"
0.045966152, .," gesture of reconciliation with the Díaz regime . As a result of the treaty he was given the right to appoint members of the la Barra cabinet . He chose mostly upper class Maderistas ,"
0.045294616, .," stream @-@ of @-@ consciousness "" album , with Gene Hoglan on drums , Craig McFarland on bass and Jamie Meyer on keyboards . Townsend cited Ween 's White Pepper as"
0.04445034, .,"ilewska , Stanisław Wasilewski , Adam <unk> , Aleksander Weintraub and Bruno Winawer . 
 Other Polish writers , however , rejected"
0.04248572, .,"aduri ) , Thakur 's reclusive , widowed daughter @-@ in @-@ law , who subtly returns his affections . 
 Skirmishes between Gabbar '"
0.04126579, .," "" the peak of mental misery , and marked the end of his ability to feel a certain kind of love "" . That winter , his father also died . By the summer of 1937 , he had embarked"
0.03954499, .," which layers consist of fused ruffled six @-@ membered rings . The nearest and next @-@ nearest neighbors form an irregular octahedral complex , with the three atoms in the same"
