Activacion,Tokens Id,Context
1.4763002, .," to provide proportional ratios and construction techniques for each section . 

 Several years later Li Jie ( <unk> ; 1065 – 1110 ) published Yingzao Fashi ( "" Treatise"
1.470944, leased," were owned or leased by the NHA . Ross scored four goals in eleven games with the Wanderers , who finished fourth in the five team league . During a match against the Quebec Bulldogs on February 25"
1.4626724, .," deacons , and based upon the proofs that are available . 


 = = Seventh commandment = = 


 The Catechism explains that this commandment regulates worldly goods , and forbids"
1.4361306, ., that additional space between sentences improves the aesthetics or readability of text . Proponents of double sentence spacing also state that some publishers may still require double @-@ spaced manuscript submissions from authors . A key
1.4301019, .," diameter ) that is observable with scanning electron microscopy . The hilar scar is a circular indentation at one end of the spore , and it most likely results during the separation of the attachment of the"
1.4256039, .," and Monotype machines , allowed for some variable sentence spacing similar to hand composition . Just as these machines revolutionized the mass production of text , the advent of the typewriter around the same time revolutionized"
1.4249918, rented," or rented from a flying club . A survey of pilots conducted between 2001 and 2002 indicated that the most common purposes of recreational flights were local flights near the base aerodrome , visits to other aerod"
1.4227569, word,"@ spaced ( illustration right ) . The relative size of the sentence spacing would vary depending on the size of the word spaces and the justification needs . For most countries , this remained the standard for published work"
1.4185048, ., <unk> reagent . The ylide conformation is determined by interaction with the bridgehead hydrogens and approach of the aldehyde is blocked by the camphor moiety . The reaction
1.4151462, .," art gallery . 

 During the Christmas season , the city of Sarnia presents the annual "" Celebration of Lights "" in Centennial Park . The event was created in 1984 by Dr. Wills"
