Activacion,Tokens Id,Context
0.1158092, =," "" and "" Bounty "" . Jamahl Epsicokhan at his website "" Jammer 's Reviews "" gave the episode two out of four , said that there was nothing exciting in "" Maraud"
0.108812906, =, and the bloodline apparently became part of the wild Kaimanawa population . Other horses were added to the bloodline through escapes and releases from local sheep stations and from cavalry units at Waiouru
0.107338265, and," and the audience is compelled to accept feudal order . Banerjea explains that though Jai and Veeru are mercenaries , they are humanised by their emotional needs . Such dualism makes them"
0.1073352, and," Sarnia from his native Hungary to join Dow Chemical in 1957 . James Doohan , the well @-@ known Star Trek actor , attended high school in Sarnia . Harmonica virtu"
0.106015764, and,"its . Jai attacks the gang , and the three are able to flee Gabbar 's hideout with dacoits in pursuit . Fighting from behind a rock , Jai and Veeru"
0.1056766, and,"plastic syndrome ( MDS ) or myeloproliferative disease ( so @-@ called secondary AML ) has a worse prognosis , as does treatment @-@ related AML"
0.104837336, and," against their Imperial rivals Calamity Raven . The anime was first announced in November 2010 . It was developed by A @-@ 1 Pictures , produced by Shinji <unk> , directed by Nobu"
0.10468527, and,lonal antibody @-@ linked cytotoxic agent <unk> <unk> ( <unk> ) was approved in the United States for people aged more than 60 years with relapsed AML
0.102978066, and,"edarite king , following Hazael 's death . That Yauta paid a tribute in the form of 10 <unk> of gold , 1 @,@ 000 precious stones , 50 camels"
0.10203171, and, stopped firing but the heavier artillery continued to engage them . The boats were about 4 miles ( 6 @.@ 4 km ) off @-@ shore when the last German salvo straddled them
