Activacion,Tokens Id,Context
1.8716997, ;," this trip , he visited various archaeological projects , but was dismayed by the quality of their excavations ; in particular , he noted that the American @-@ run excavation at Tel Megiddo was"
1.8481628, ;," up ( it turns out that he has nothing useful to do ! ) ; and indeed , many standard Black openings are not very inspiring when one gets them as White , tempo in hand . "" GM Alex"
1.8268554, ;," as more than a physical act ; it also affects body and soul , so the Church teaches that chastity is a virtue all people are called to acquire . It is defined as the inner unity of a"
1.8200479, ;," targeted books that were considered to be "" serious "" , including scientific and educational texts and texts that were thought to promote Polish patriotism ; only fiction that was free of anti @-@ German overtones was"
1.8191996, ;," He expressed little interest in his relatives ; in later life he saw no reason to have a social relationship with people purely on the basis of family ties . 

 Wheeler was married three times . In May"
1.8106263, ;," the same role in nature ; Ra , Atum , <unk> , Horus , and other deities acted as sun gods . Despite their diverse functions , most gods had an overarching role in common : maintaining"
1.8064705, ;," to growing Welsh nationalism during this period ; for instance , the Welsh nationalist party Plaid Cymru was founded in 1925 . 

 Wheeler was impatient to start excavations , and in July 1921 started"
1.798946, ;," up a prospectus containing research questions that he wanted the Survey to focus on ; these included understanding the period between the Bronze Age Indus Valley Civilization and the Achaemenid Empire , discerning the"
1.7864406, ;," had met with some success ; Nielly had captured a number of British merchant ships and Montagu had taken several back . Nielly was the first to encounter the grain convoy , deep in the"
1.7851326, ;," never raised for scrapping ; the wreck is still sitting on the bottom of the bay . 


 = = Construction and design = = 


 Markgraf was ordered under the provisional name"
