Activacion,Tokens Id,Context
0.23449424, another," another attempt on the next full tide , rejecting Mallory 's idea that he wait until the nearly complete ironclad Savannah was finished before his next sortie . In the meantime , Rear Admiral Samuel F"
0.23449424, another," another on 21 – 22 April . On 24 April , the battlecruisers of Rear Admiral Franz von Hipper 's I Scouting Group conducted a raid on the English coast . Markgraf and the"
0.23449424, another," another two @-@ day advance into the North Sea . On 11 – 12 September , Markgraf and the rest of III Squadron supported a minelaying operation off Texel . Another unevent"
0.22235128, achievements," achievements of Griffith and Ford "" , while Richard Schickel proclaimed it "" one of the most wholly original American movies ever made "" . 
 = = = 2010s = = = 
 ="
0.21895438, system," system ; specifically , it enhanced the activity of mouse natural killer cells , stimulated macrophages to produce nitric oxide , and enhanced production of cytokines . The activation of macrophages by AE2"
0.2115305,leon,"leon , where he focused on revealing the Roman amphitheatre . Intent on attracting press attention to both raise public awareness of archaeology and attract new sources of funding , he contacted the press and organised a"
0.20994273, occupying," occupation began , most libraries were closed ; in Kraków , about 80 % of the libraries were closed immediately , while the remainder saw their collections decimated by censors . The occupying powers destroyed"
0.20921686, Hew,"-@ great @-@ grandfathers was John Hewson ( 1744 – 1821 ) , a textile manufacturer who immigrated to America with the support of Benjamin Franklin , enabling Hewson to quickly"
0.20759112,urt," Geffen 's Jimmy Iovine , who helped to develop the Pussycat Dolls , a girl group known for their sexually suggestive dance routines . The writer also criticised Furtado 's"
0.20693016,itz," an appeal to the Court of Appeals for the Third Circuit . In a unanimous opinion , the Court of Appeals ( consisting of <unk> , Greenberg and Seitz ) confirmed that there was no restriction of"
