Activacion,Tokens Id,Context
0.044591747, ,"ansfield was featured on £ 5 Exeter Pound notes in the city . 
 Exeter City and Yeovil Town agreed that on their meeting at St James Park on 8 August 2015 , there"
0.043524146, !," Neighbors ! ! They Have Come Back from the Dead ! ! Ahhhh ! "" makes references to ghost towns of Illinois . Stevens relates experiences from a summer camp he went to as a child in Michigan"
0.039632626, ," private sites , air balloon incidents , parachute dropping , and alleged low flying . 
 Planning guidance on aircraft noise advises that "" in some circumstances the public perceive general aircraft noise levels as more disturbing than similar"
0.03954324, Stories, edition of the first run included material from both Super Science Stories and Astonishing Stories ; it was unusual in that it printed some original fiction rather than just reprints . There were also Canadian and British reprint
0.038553998, They," vocals on "" They Are Night Zombies ! ! They Are Neighbors ! ! They Have Come Back from the Dead ! ! Ahhhh ! "" 
 Rob Moose – violin 
 Matt Morgan – backing"
0.03792461, Stories," imprint , which was used for lower @-@ paying magazines . Super Science Stories ' first issue was dated March 1940 ; it was bimonthly , with Astonishing Stories appearing in the alternate months"
0.034263626, Roman," Egyptian god Serapis — were adopted into Roman religion and spread across the Roman Empire . Roman emperors , like Ptolemaic kings before them , invoked Isis and Serapis to endorse"
0.033842772, ,"itz did not write the book , and may not have even read it . 
 Finkelstein noted 20 instances , in as many pages , where Dershowitz 's book cites the same"
0.03302432, Guitar," on a low difficulty could potentially beat a player on a more challenging difficulty . Guitar Hero III introduced Boss Battles , in which two players face off against each other , attempt to collect "" distractions "" to throw"
0.033008855, Metropolitan," . Bob Broadhurst , who is in charge of public order policing at the Metropolitan Police , said in a statement to the NUJ in 2008 that journalists , "" on the production of a valid form"
