Activacion,Tokens Id,Context
0.078273654, =," – 09 season , the average attendance at Crabble was 1 @,@ 293 , the highest in the division . The highest home attendance in the club 's history was 5 @,@ 645"
0.06931855, and," with 41 @.@ 9 seconds remaining in the fourth quarter , Phil Jackson called a timeout . When play resumed , Jordan received the inbound pass , drove to the basket , and hit a shot over"
0.06803857, =," by Marylin , to stay away from the baby . James defended Nicole stating : "" I think it 's hard to not bond , but this is Marilyn 's baby , and Nicole is so young"
0.06757899, =," defeat , who played in the Eastern Canada Amateur Hockey Association ( ECAHA ) , the successor league to the CAHL as the premier league in the country . He scored eight goals in ten games over"
0.06326267, and," his concussion after two games , making a start against the Vancouver Canucks . Mason allowed only one goal in the game despite suffering from cramping in the third period , temporarily being replaced by Sanford for just over"
0.060595468, and," however , both companies managed to establish strong positions on the western ridge overlooking San Leonardo . During the night of 8 / 9 December , units of the Royal Canadian Engineers ( RCE ) constructed a bridge over"
0.060582265, =," and the fruit @-@ tree wild "" ) as the pauses after the commas are a "" masculine "" pause . Furthermore , Keats began to reduce the amount of Latin @-@ based words"
0.060405746, =," when your friends are your family , "" basing the show on their own experiences as young people living in New York ; the main characters themselves were inspired by their own friends . Conceived as a young"
0.058869556, and," ) . Malaya fired a torpedo at Markgraf at 19 : 05 , but the torpedo missed due to the long range . Around the same time , Markgraf engaged a cruiser from the 2"
0.05836971, and," leading role of Connor . He became involved in the film after reading an early script draft in 2006 . In 2008 , the global financial crisis severely reduced the budget of the film , and Nesbitt"
