Activacion,Tokens Id,Context
0.08642526, news," Paul Tisdale told local news programme BBC Spotlight that "" there 's little good on this subject "" , but "" if there 's someone who can deal with it and meet it head on with"
0.08219206,verson," Tracy McGrady and Allen Iverson , but refused both . In the end he accepted the spot of Vince Carter , who decided to give it up under great public pressure . 
 Jordan 's final"
0.08046718, Guild," their younger children were concerned : Guildford , aged about 17 , married Lady Jane Grey , while Katherine , who was between eight and ten years old , was promised to the Earl of Huntingdon 's"
0.07865532, declaration, Emergency declaration for the territory . Public schools would be closed on October 16 . All non @-@ essential workers would be dismissed at 10 a.m. local time . At 6 p.m.
0.07581791,ifying," 4 in its "" 13 Terrifying Modern Horror Comics "" , stating that "" Constantine ’ s most frightening encounters have hewn close enough to that kernel of truth to remind readers that real life can be"
0.07534604, governors," a veto . Following negotiations with governors at Carre 's , the scheme was revised so that Carre 's would be an 11 – 18 school and adsorb Sleaford Secondary Modern 's"
0.073380664, contract," million contract , with a club option for 2016 . This reunited him with former teammate and fellow ex @-@ Twins great , Torii Hunter along with Rangers teammate Ian Kinsler . On May 5"
0.07179859, separate," into separate courses for Resistant Materials , Graphics , Electronics and Engineering ; Mandarin is also available as an optional extra subject , but is studied after school . 
 = = = Sixth Form = = ="
0.071484864, can," good reactive possibilities , this initiative can be absorbed and often passes over to Black . "" Fourth , "" The fact that White moves before Black often gives Black useful information "" . Suba likewise argues that White"
0.070613965, ripped,"aster ripped three barges from their moorings . One of the barges traveled across the Long Island Sound and ran aground near Port Jefferson , New York . A man in Milford was killed"
