Activacion,Tokens Id,Context
0.38932076, those," Polish schools were closed , and those that remained open saw their curricula altered significantly . 
 Nevertheless , underground organizations and individuals – in particular the Polish Underground State – saved much of Poland 's most"
0.36562896, pick," round draft pick ; the team was given the choice of taking the pick in either 2012 or 2013 . At the deadline , Columbus was unable to come to terms on a deal involving Nash , but they did"
0.36244473, chambers," hall into a series of smaller chambers . The roof of the hall has concealed beams supported by stone columns joined together by capitals . The cave entrance is aligned with the north – south axis , unusual for a"
0.36178678, although," Hamilton for Jerry Stackhouse ( although Jordan was not technically Director of Basketball Operations in 2002 ) . On May 7 , 2003 , Wizards owner Abe Pollin fired Jordan as Washington 's President of Basketball Operations"
0.3601777, therefore," surprise had been compromised , and therefore called off the operation . This was to be the last military action Erzherzog Ferdinand Max was to take part in , and she and her sisters spent the"
0.35917082,>," Jackets dealt Antoine <unk> to the Phoenix Coyotes for two draft picks and goaltender Curtis McElhinney . Despite being injured at the time , the acquisition of McElhinney was believed to"
0.35881272, give," a severe reduction in GA would give "" some merit to the argument that pilot recruitment would be threatened "" , but that the data on flying hours "" does not support such a gloomy outlook . "" Of course"
0.3583397, Long," Engraver James B. Longacre , successor to Gobrecht ( who had died in 1844 ) . A former copper @-@ plate engraver , Longacre had been appointed through"
0.3577152, 1918," soon after Poland regained independence in 1918 , whose adolescence was marked by World War II . In their art , they "" discovered a new Poland "" – one forever changed by the atrocities of World War II and"
0.35680023, Fey," explained that there was chemistry between Fey and Fallon , though the decision was "" kind of risky "" at the time . Her role in Weekend Update was well received by critics . Ken Tucker of Entertainment Weekly wrote"
