Activacion,Tokens Id,Context
0.29073113,itt," latter part of the year . Nesbitt had previously worked with the film 's director and co @-@ writer Colm McCarthy on Murphy 's Law , which was one reason he took"
0.28678775, tours," Beyoncé ’ s concert tours . The song was the closing track of her Dangerously in Love World Tour that began in late 2003 . Beyoncé performed "" Crazy in Love "" live at the 2004"
0.28642473,>," indigo blue to <unk> or grayish blue . The interior of the stem is solid and firm initially , but develops a hollow with age . Like the cap , it is initially sticky or slim"
0.28554824, end," diet associates to higher risk of endometrial , breast and prostate cancer as well as to osteoporosis in humans . A recent study has demonstrated that endometrial tissue is characterized by higher levels"
0.28554553, to," got to be a way / to connect this world today . "" The song begins with Carey publicly denouncing the existence of poverty and racism in the world , and she uses the bridge to shift the lyrics towards"
0.28543258,itt,"a , County Antrim , Nesbitt grew up in the nearby village of <unk> , before moving to Coleraine , County Londonderry . He wanted to become a teacher"
0.28347138, later," memorial service was held twelve days later on July 7 , and the finale featured group renditions of the Jackson anthems "" We Are the World "" and "" Heal the World "" . The singalong"
0.28179115, relationship," try her best to make their relationship work . However , after Freya kisses her they enter a few rocky periods and later break up . 
 She starts a relationship with troublesome Trey . He films them"
0.28152105, ship," News Shipbuilding shipyards in Newport News , Virginia using specifications and detail designs drawn up by Bath Iron Works . 
 She had a standard displacement of 1 @,@ 213 tonnes ( 1 @,"
0.2809774,>,"2 Qc7 <unk> Rc8 Although the pawn structure is still symmetrical , Black 's control of the c @-@ file gives him the advantage . Black ultimately reached an end"
