Activacion,Tokens Id,Context
1.7904677, through," for the publisher , known as "" New Aspects of Antiquity "" , through which they released a variety of archaeological works . The rival publisher Weidenfeld & Nicolson had also persuaded Wheeler to work"
1.7179215, resembled, with the girls being each other 's date and solemnly dancing whilst everyone else has a good time . Metro writer Rebecca Lewis noted that the man in the video strongly resembled Perrie 's former fian
1.7089026, through," ) above a plaza , a large court for playing the Mesoamerican ballgame , and over 100 carved monuments , most dating from the 6th century through the 9th centuries AD , during the"
1.7029462, through," = 


 Wheeler became famous in Britain as "" the embodiment of popular archaeology through the medium of television "" . In 1952 , Wheeler was invited to be a panelist on the new BBC television"
1.6961689, into, pupil . This was later adapted into a ten volume <unk> comic book . He also appears in a novel concerning one of his fictional martial arts brothers . He was portrayed by three different actors in a
1.6937038, creating," Sarah Palin , and for creating acclaimed series 30 Rock ( 2006 – 2013 ) and Unbreakable Kimmy Schmidt ( 2015 – present ) . She is also well known for appearing in films such as Mean"
1.643976, on,"owers notes that the head of Liberty on the Type 1 dollar is a scaled @-@ down version of that on the double eagle , and "" a nicely preserved gold dollar is beautiful to behold "" ."
1.6402023, into," @-@ foot ( 2 @.@ 4 m ) ledge into the beach . On Carolina Beach , dunes were breached and some roads , including portions of North Carolina Highway 12 , were closed ."
1.6286142, through," unconstitutional , stating that it violated both the Fourteenth and Seventeenth Amendments due to the failure to ensure "" popular participation "" through the use of primary elections . This decision was reached following an analysis of the"
1.6228259, creating," Hartley for "" the depth of his research and for creating a wildly entertaining film experience "" , and claimed that "" for those of us who remember the films , Not Quite Hollywood is a blast "" ."
