Activacion,Tokens Id,Context
0.04551564, L," harbour . The commanders of MLs 160 and 443 , Lieutenants T Boyd and T D L Platt , were awarded the Distinguished Service Order for their bravery . The rest of the port column"
0.0450297, Hib," pop phenomenon . When <unk> Bachi author Hiroyuki Asada read Stop ! ! Hibari @-@ kun ! in junior high school , he admired its novel sensibility , and"
0.04107605,ok," school years . While in elementary , she participated in an audition held at the Nippon Budokan , and it was during this time she decided to become an artist . In junior high school ,"
0.039233893, Army," Ministry , while his rival , General Anupong Paochinda , was promoted to lead the Army . As a result , Saprang retired from the Army in 2010 . 
 = = Education and"
0.038726076, gallery," the fort 's north . Between the 10 "" guns is a T @-@ shaped loading gallery that draws shells and gunpowder via a hoist system from the magazine below . Either side of the"
0.037161298, turns," . The road intersects a railroad owned by BNSF Railway . N @-@ 88 turns northeast soon after , and ends at the intersection of US 385 and N @-@ 92 . In"
0.03693995, reflect," . The video was set as a "" peaceful and relaxing "" setting , in order to try to reflect the sweet and mellow song 's message . "" Forever "" , the album 's fifth single"
0.036272094, James," born , and Elizabeth moved back into her parents ' home in Bolton . Elizabeth 's father , James Hugh "" Jim "" Riley , became Lawton 's surrogate father . Lawton 's natural football"
0.036259674, !," beach birth scenes , the magazine website editor quipped "" Who knew sand had birthing properties ? ! Well , maybe not ... but you could forgive pregnant teen Nicole for thinking that after a casual stroll along"
0.035437822, Army, and the 4th Territorial Army Corps and in turn they used to be called the 1st Army and 4th Army prior to 2000 . However due to their personnel having been reduced considerably in order to
