Activacion,Tokens Id,Context
0.05171494, =," that he "" hit the wall with play @-@ along music games "" , and challenged the game makers to explore other ways to combine music and video games . Analysts stated that such games must continue"
0.0511332, and," Krak des Chevaliers can be classified both as a spur castle , due to its site , and after the 13th @-@ century expansion a fully developed concentric castle . It was similar"
0.04814466, and," and beauty because of its message that "" the works of God completely overshadow our own feeble attempts at creation . "" Considering this sentiment , the enduring popularity of "" Trees "" is evinced by its association"
0.046917893, and," , when using a drum controller that is velocity @-@ sensitive , are "" armored "" , requiring the player to hit the indicated drum pad harder to score more points . Vocal tracks are played similar"
0.04466623, and," a teacher at his primary school . He was auditioned by the choirmaster Jeremy Suter and accepted into the choir at the age of seven . Johnston 's mother , who had no previous association"
0.04371144, =," Though the season had no official bounds , most tropical cyclone activity occurred during August and September . Throughout the year , fourteen tropical cyclones formed , of which nine reached tropical storm intensity ; six were hurricanes"
0.04346589, =," but the British suspect Japanese involvement since the spacecraft landed in the Sea of Japan . To investigate , MI6 operative James Bond is sent to Tokyo after faking his own death in Hong Kong and being buried"
0.042654753, =," the objective . Despite the arrival of several Panzer IVs , Triquet 's remaining forces captured the manor house at 14 : 30 . However , only 14 men of C Company remained fit to continue"
0.042290375, =,"verse bands . The transverse bands are often broken to form six spots . Some or all of these spots may be lacking , however . 
 Zygoballus sexpunctatus is similar"
0.041886687, =," = Testing and evaluation = = = 
 The prototype was completed in July and was first flown on 27 July 1947 . Two aircraft were shown at the Tushino Aviation Day Display on 3 August 1947"
